feature,threshold,direction,auc_roc,auc_pr,precision,recall,f1,f2,n_test,source
hct,33.0,below,0.5684,0.0118,0.0138,0.4868,0.0268,0.0619,28940,"Similar to hemoglobin, a low hematocrit can indicate anemia associated with RA."
hgb,11.0,below,0.5563,0.0115,0.0128,0.4704,0.0249,0.0577,28942,"Anemia is frequently observed in RA, particularly anemia of chronic disease, which can be detected by a low hemoglobin level."
mch,25.0,below,0.4623,0.0098,0.0096,0.0395,0.0154,0.0243,28902,Low mean corpuscular hemoglobin (MCH) can also be associated with microcytic anemia in RA.
mchc,30.0,below,0.4653,0.0095,0.0093,0.0263,0.0137,0.0193,28903,Low mean corpuscular hemoglobin concentration (MCHC) can be seen in microcytic anemia in RA.
mcv,80.0,below,0.4798,0.0104,0.0094,0.0428,0.0154,0.025,28902,"Microcytosis (low MCV) can be seen in RA, particularly in the context of anemia of chronic disease."
plt,400.0,above,0.5864,0.0153,0.0226,0.1086,0.0374,0.0616,28895,"Thrombocytosis is sometimes observed in RA, potentially due to inflammation or other factors."
rbc,4.0,below,0.5719,0.0121,0.0123,0.6612,0.0242,0.0574,28902,Low red blood cell count can indicate anemia associated with RA.
rdw,15.0,above,0.6029,0.013,0.0142,0.3388,0.0273,0.0609,28893,"Elevated RDW is a common finding in RA, reflecting increased red blood cell variation in size, often due to chronic inflammation."
wbc,12.0,above,0.4876,0.0102,0.0095,0.1974,0.0182,0.0399,28908,"Elevated white blood cell count can be seen in RA, reflecting inflammation and immune activation."
