feature,threshold,direction,auc_roc,auc_pr,precision,recall,f1,f2,n_test,source
rdw,16.0,above,0.6169,0.0132,0.0131,0.1933,0.0245,0.0514,29237,"Elevated RDW is a common finding in RA, reflecting increased red blood cell variation in size."
hgb,11.0,below,0.569,0.0123,0.0124,0.4667,0.0242,0.0561,29276,Anemia is frequently observed in RA due to chronic inflammation and iron deficiency.
hct,33.0,below,0.5786,0.0126,0.0131,0.4767,0.0256,0.0591,29275,Anemia is frequently observed in RA due to chronic inflammation and iron deficiency.
wbc,12.0,above,0.4786,0.0099,0.0095,0.1967,0.0181,0.0397,29251,"Elevated WBC count can indicate inflammation and infection, which may be associated with RA."
plt,400.0,above,0.5723,0.0133,0.0162,0.08,0.027,0.0448,29223,"Thrombocytosis is sometimes seen in RA, potentially due to inflammation and increased platelet production."
mcv,80.0,below,0.4824,0.0096,0.0076,0.0367,0.0126,0.0207,29244,Microcytosis (low MCV) can be seen in RA due to iron deficiency anemia.
mch,25.0,below,0.4627,0.0092,0.0061,0.0267,0.0099,0.0159,29244,"Low MCH is associated with microcytic anemia, often seen in iron deficiency."
mchc,28.0,below,0.4672,0.0092,0.0,0.0,0.0,0.0,29245,"Low MCHC is associated with microcytic anemia, often seen in iron deficiency."
rbc,4.0,below,0.5861,0.0141,0.0128,0.7033,0.0251,0.0596,29244,Anemia is frequently observed in RA due to chronic inflammation and iron deficiency.
